{
  "$schema": "https://llm-catalog.example.cn/schemas/canonical-model.schema.json",
  "schema_version": "2.4.0",
  "canonical_id": "zhipu/glm-4.6v",
  "manufacturer_id": "zhipu",
  "name": "GLM-4.6V",
  "family": "GLM-4.6V",
  "aliases": [],
  "kind": "chat",
  "lifecycle": {
    "release_date": "unknown",
    "last_updated": "unknown",
    "status": "active",
    "deprecated_at": "unknown",
    "replacement": "unknown"
  },
  "limits": {
    "max_context_tokens": 131072,
    "max_input_tokens": "unknown",
    "max_output_tokens": 32768
  },
  "modalities": {
    "input_modalities": ["text", "image", "video", "file"],
    "output_modalities": ["text"]
  },
  "capabilities": {
    "agent": {
      "streaming": true,
      "stream_usage": "unknown",
      "system_message": "unknown",
      "tool_call": true,
      "tool_choice": "unknown",
      "parallel_tool_calls": "unknown",
      "strict_tools": "unknown",
      "structured_output": "unknown",
      "json_schema": "unknown"
    },
    "reasoning": {
      "supported": true,
      "modes": ["switchable"],
      "effort_values": ["unknown"],
      "budget_tokens": "unknown",
      "interleaved_reasoning": "unknown",
      "protocol_fields": {
        "openai_chat_completions": "thinking.type"
      }
    }
  },
  "embedding": null,
  "evidence": [
    {
      "source_id": "zhipu-glm-4.6v-model",
      "source_url": "https://docs.bigmodel.cn/cn/guide/models/vlm/glm-4.6v",
      "source_type": "official_docs",
      "retrieved_at": "2026-08-02T00:00:00Z",
      "verified_at": "2026-08-02T00:00:00Z",
      "confidence": "high",
      "redistribution": "unknown",
      "notes": "用于 128K 上下文、输入输出模态、可切换思考、流式和原生工具调用能力。"
    },
    {
      "source_id": "zhipu-core-parameters",
      "source_url": "https://docs.bigmodel.cn/cn/guide/start/concept-param",
      "source_type": "official_docs",
      "retrieved_at": "2026-08-02T00:00:00Z",
      "verified_at": "2026-08-02T00:00:00Z",
      "confidence": "high",
      "redistribution": "unknown",
      "notes": "用于核验 glm-4.6v 最大输出 32768；采样能力未作模型级推断。"
    },
    {
      "source_id": "project-fde-head",
      "source_url": "urn:git:fses-design-mono:c88e5def41856e42449d52ed6d1b05e6fab09d12",
      "source_type": "project_audit",
      "retrieved_at": "2026-08-02T00:00:00Z",
      "verified_at": "2026-08-02T00:00:00Z",
      "confidence": "high",
      "redistribution": "restricted",
      "notes": "仅记录当前视觉角色配置出现该标识和运行时路径。"
    }
  ],
  "field_annotations": {
    "/canonical_id": { "runtime_effective": false, "metadata_only": true, "adapter_mapping": null, "unsupported_reason": null, "source_ids": ["zhipu-glm-4.6v-model", "project-fde-head"] },
    "/manufacturer_id": { "runtime_effective": false, "metadata_only": true, "adapter_mapping": null, "unsupported_reason": null, "source_ids": ["zhipu-glm-4.6v-model"] },
    "/name": { "runtime_effective": false, "metadata_only": true, "adapter_mapping": null, "unsupported_reason": null, "source_ids": ["zhipu-glm-4.6v-model"] },
    "/family": { "runtime_effective": false, "metadata_only": true, "adapter_mapping": null, "unsupported_reason": null, "source_ids": ["zhipu-glm-4.6v-model"] },
    "/aliases": { "runtime_effective": false, "metadata_only": true, "adapter_mapping": null, "unsupported_reason": null, "source_ids": ["zhipu-glm-4.6v-model"] },
    "/kind": { "runtime_effective": true, "metadata_only": false, "adapter_mapping": "FDE modelType role-admission gate", "unsupported_reason": null, "source_ids": ["zhipu-glm-4.6v-model", "project-fde-head"] },
    "/lifecycle/*": { "runtime_effective": false, "metadata_only": true, "adapter_mapping": null, "unsupported_reason": null, "source_ids": ["zhipu-glm-4.6v-model"] },
    "/limits/max_context_tokens": { "runtime_effective": true, "metadata_only": false, "adapter_mapping": "current FDE model.profile.maxInputTokens (semantic mismatch; must be replaced)", "unsupported_reason": "当前实现混用了 context 与 input 限额。", "source_ids": ["zhipu-glm-4.6v-model", "project-fde-head"] },
    "/limits/max_input_tokens": { "runtime_effective": false, "metadata_only": false, "adapter_mapping": "DeepAgent model.profile.maxInputTokens", "unsupported_reason": "官方未单独给出 max_input_tokens，当前项目也无该字段。", "source_ids": ["zhipu-glm-4.6v-model", "project-fde-head"] },
    "/limits/max_output_tokens": { "runtime_effective": true, "metadata_only": false, "adapter_mapping": "ChatOpenAI.maxTokens", "unsupported_reason": null, "source_ids": ["zhipu-core-parameters", "project-fde-head"] },
    "/modalities/*": { "runtime_effective": false, "metadata_only": false, "adapter_mapping": "FDE vision role content-part validation", "unsupported_reason": "当前仅以粗粒度 Multi 类型放行视觉角色。", "source_ids": ["zhipu-glm-4.6v-model", "project-fde-head"] },
    "/capabilities/agent/*": { "runtime_effective": false, "metadata_only": false, "adapter_mapping": "capability-aware ChatOpenAI/DeepAgent adapter", "unsupported_reason": "当前 FDE 未消费细粒度 Agent 能力。", "source_ids": ["zhipu-glm-4.6v-model", "project-fde-head"] },
    "/capabilities/agent/tool_call": { "runtime_effective": true, "metadata_only": false, "adapter_mapping": "current coarse functionCallSupport admission gate", "unsupported_reason": "当前枚举无法表达其余工具能力。", "source_ids": ["zhipu-glm-4.6v-model", "project-fde-head"] },
    "/capabilities/reasoning/supported": { "runtime_effective": false, "metadata_only": true, "adapter_mapping": null, "unsupported_reason": null, "source_ids": ["zhipu-glm-4.6v-model", "project-fde-head"] },
    "/capabilities/reasoning/*": { "runtime_effective": false, "metadata_only": false, "adapter_mapping": "ChatOpenAI.modelKwargs.thinking", "unsupported_reason": "当前 FDE 未发送 thinking 参数。", "source_ids": ["zhipu-glm-4.6v-model", "project-fde-head"] },
    "/embedding": { "runtime_effective": false, "metadata_only": true, "adapter_mapping": null, "unsupported_reason": null, "source_ids": ["zhipu-glm-4.6v-model"] }
  }
}
