{
  "$schema": "https://llm-catalog.example.cn/schemas/canonical-model.schema.json",
  "schema_version": "2.4.0",
  "canonical_id": "openai/gpt-5.5",
  "manufacturer_id": "openai",
  "name": "GPT-5.5",
  "family": "GPT-5",
  "aliases": ["gpt-5.5-2026-04-23"],
  "kind": "chat",
  "lifecycle": {
    "release_date": "unknown",
    "last_updated": "unknown",
    "status": "active",
    "deprecated_at": "unknown",
    "replacement": "unknown"
  },
  "limits": {
    "max_context_tokens": 1050000,
    "max_input_tokens": "unknown",
    "max_output_tokens": 128000
  },
  "modalities": {
    "input_modalities": ["text", "image"],
    "output_modalities": ["text"]
  },
  "capabilities": {
    "agent": {
      "streaming": true,
      "stream_usage": "unknown",
      "system_message": "unknown",
      "tool_call": true,
      "tool_choice": "unknown",
      "parallel_tool_calls": "unknown",
      "strict_tools": "unknown",
      "structured_output": true,
      "json_schema": true
    },
    "reasoning": {
      "supported": true,
      "modes": ["effort"],
      "effort_values": ["none", "low", "medium", "high", "xhigh"],
      "budget_tokens": "unknown",
      "interleaved_reasoning": "unknown",
      "protocol_fields": {
        "openai_chat_completions": "reasoning_effort",
        "openai_responses": "reasoning.effort"
      }
    }
  },
  "embedding": null,
  "evidence": [
    {
      "source_id": "openai-gpt-5.5-model",
      "source_url": "https://developers.openai.com/api/docs/models/gpt-5.5",
      "source_type": "official_docs",
      "retrieved_at": "2026-08-02T00:00:00Z",
      "verified_at": "2026-08-02T00:00:00Z",
      "confidence": "high",
      "redistribution": "unknown",
      "notes": "仅摘录模型标识、快照、限额、模态、端点和明确列出的能力事实；未镜像文档正文。"
    },
    {
      "source_id": "openai-gpt-5.5-guidance",
      "source_url": "https://developers.openai.com/api/docs/guides/latest-model?model=gpt-5.5",
      "source_type": "official_docs",
      "retrieved_at": "2026-08-02T00:00:00Z",
      "verified_at": "2026-08-02T00:00:00Z",
      "confidence": "high",
      "redistribution": "unknown",
      "notes": "用于核验 reasoning effort 选项及结构化输出、工具工作流说明。"
    },
    {
      "source_id": "project-fde-head",
      "source_url": "urn:git:fses-design-mono:c88e5def41856e42449d52ed6d1b05e6fab09d12",
      "source_type": "project_audit",
      "retrieved_at": "2026-08-02T00:00:00Z",
      "verified_at": "2026-08-02T00:00:00Z",
      "confidence": "high",
      "redistribution": "restricted",
      "notes": "仅记录当前项目出现该 API 模型标识及运行时映射审计结论，不复制私有仓库内容。"
    }
  ],
  "field_annotations": {
    "/canonical_id": {
      "runtime_effective": false,
      "metadata_only": true,
      "adapter_mapping": null,
      "unsupported_reason": null,
      "source_ids": ["openai-gpt-5.5-model", "project-fde-head"]
    },
    "/manufacturer_id": {
      "runtime_effective": false,
      "metadata_only": true,
      "adapter_mapping": null,
      "unsupported_reason": null,
      "source_ids": ["openai-gpt-5.5-model"]
    },
    "/name": {
      "runtime_effective": false,
      "metadata_only": true,
      "adapter_mapping": null,
      "unsupported_reason": null,
      "source_ids": ["openai-gpt-5.5-model"]
    },
    "/family": {
      "runtime_effective": false,
      "metadata_only": true,
      "adapter_mapping": null,
      "unsupported_reason": null,
      "source_ids": ["openai-gpt-5.5-model"]
    },
    "/aliases": {
      "runtime_effective": false,
      "metadata_only": true,
      "adapter_mapping": null,
      "unsupported_reason": null,
      "source_ids": ["openai-gpt-5.5-model"]
    },
    "/kind": {
      "runtime_effective": true,
      "metadata_only": false,
      "adapter_mapping": "FDE modelType role-admission gate",
      "unsupported_reason": null,
      "source_ids": ["openai-gpt-5.5-model", "project-fde-head"]
    },
    "/lifecycle/*": {
      "runtime_effective": false,
      "metadata_only": true,
      "adapter_mapping": null,
      "unsupported_reason": null,
      "source_ids": ["openai-gpt-5.5-model"]
    },
    "/limits/max_context_tokens": {
      "runtime_effective": true,
      "metadata_only": false,
      "adapter_mapping": "current FDE model.profile.maxInputTokens (semantic mismatch; must be replaced)",
      "unsupported_reason": "当前实现错误地把 context 上限当作 input 上限，后续集成不得沿用。",
      "source_ids": ["openai-gpt-5.5-model", "project-fde-head"]
    },
    "/limits/max_input_tokens": {
      "runtime_effective": false,
      "metadata_only": false,
      "adapter_mapping": "DeepAgent model.profile.maxInputTokens",
      "unsupported_reason": "当前数据库与 FDE 契约缺少独立 max_input_tokens；unknown 时必须 fail closed 或由租户显式 override。",
      "source_ids": ["openai-gpt-5.5-model", "project-fde-head"]
    },
    "/limits/max_output_tokens": {
      "runtime_effective": true,
      "metadata_only": false,
      "adapter_mapping": "ChatOpenAI.maxTokens / ChatAnthropic.maxTokens",
      "unsupported_reason": null,
      "source_ids": ["openai-gpt-5.5-model", "project-fde-head"]
    },
    "/modalities/*": {
      "runtime_effective": false,
      "metadata_only": false,
      "adapter_mapping": "FDE role-admission and content-part validation",
      "unsupported_reason": "当前 FDE 只消费粗粒度 modelType，未消费目录模态数组。",
      "source_ids": ["openai-gpt-5.5-model", "project-fde-head"]
    },
    "/capabilities/agent/*": {
      "runtime_effective": false,
      "metadata_only": false,
      "adapter_mapping": "capability-aware ChatOpenAI/DeepAgent adapter",
      "unsupported_reason": "当前 FDE 未消费细粒度 Agent 能力，streaming 仍为硬编码。",
      "source_ids": ["openai-gpt-5.5-model", "project-fde-head"]
    },
    "/capabilities/agent/tool_call": {
      "runtime_effective": true,
      "metadata_only": false,
      "adapter_mapping": "current coarse functionCallSupport admission gate",
      "unsupported_reason": "当前仅映射为粗粒度枚举，不能代表 tool_choice、parallel 或 strict。",
      "source_ids": ["openai-gpt-5.5-model", "project-fde-head"]
    },
    "/capabilities/reasoning/supported": {
      "runtime_effective": false,
      "metadata_only": true,
      "adapter_mapping": null,
      "unsupported_reason": null,
      "source_ids": ["openai-gpt-5.5-model", "project-fde-head"]
    },
    "/capabilities/reasoning/*": {
      "runtime_effective": false,
      "metadata_only": false,
      "adapter_mapping": "ChatOpenAI.reasoning / protocol request fields",
      "unsupported_reason": "当前 FDE 仅记录 isReasonModel，未构造 reasoning 参数。",
      "source_ids": ["openai-gpt-5.5-guidance", "project-fde-head"]
    },
    "/embedding": {
      "runtime_effective": false,
      "metadata_only": true,
      "adapter_mapping": null,
      "unsupported_reason": null,
      "source_ids": ["openai-gpt-5.5-model"]
    }
  }
}
